{
  "$schema": "https://json-schema.org/draft/2020-12/schema",
  "$id": "https://jseverino.com/schemas/cordon-checks-v2.json",
  "$comment": "Canonical home: https://jseverino.com/schemas/cordon-checks-v2.json (the value of $id above) — the live, immutable URL this schema_version pins. The copy in the cordon repo at schema/cordon-checks-v2.json is the byte-identical development mirror; reference it for validation. v2 extends v1 (the repo-shippability verdict) with the two signals the gate engine adds: per-check `phase` (where a check runs around the build) and `unmet` (the capabilities a skipped check needed but the environment lacked) — so an agent reads WHY a check skipped, not just THAT it did, in the machine verdict instead of human prose. checks/run.ts --json is the reference emitter.",
  "title": "Cordon checks verdict (schema_version 2)",
  "type": "object",
  "additionalProperties": false,
  "required": [
    "ok",
    "schema_version",
    "failed",
    "report",
    "checks"
  ],
  "properties": {
    "ok": {
      "type": "boolean",
      "$comment": "The gate: true iff no check failed. A skipped check never fails the gate."
    },
    "schema_version": { "const": 2 },
    "failed": {
      "type": "array",
      "uniqueItems": true,
      "items": { "type": "string", "minLength": 1 },
      "$comment": "ids of the failed checks — the same ids that appear in checks[].id with status 'fail'."
    },
    "report": {
      "type": ["string", "null"],
      "$comment": "Relative path to the written failure report, or null when ok."
    },
    "checks": {
      "type": "array",
      "items": { "$ref": "#/$defs/check" }
    }
  },
  "$defs": {
    "effect": {
      "enum": ["read", "local_write", "vault_write", "remote_write", "deploy"]
    },
    "phase": {
      "enum": ["pre-build", "build", "post-build"],
      "$comment": "Where the check runs in the gate's ordering. Emitted only when a check declares one; absent means the engine's default (pre-build)."
    },
    "check": {
      "type": "object",
      "additionalProperties": false,
      "required": ["id", "name", "status", "durationMs", "effect"],
      "properties": {
        "id": { "type": "string", "minLength": 1 },
        "name": { "type": "string", "minLength": 1 },
        "status": { "enum": ["pass", "fail", "skip"] },
        "durationMs": {
          "type": "integer",
          "minimum": 0,
          "$comment": "The one runtime field — a verdict is a report, not a static description, so wall-clock cost is legitimately part of it. Everything else is deterministic: checks ride in registry/phase order, failed[] is derived."
        },
        "effect": {
          "$ref": "#/$defs/effect",
          "$comment": "The check's own blast radius on cordon's ladder — the cost of producing this row, in the same vocabulary a command's --describe uses. A `command` entry (a spawned spec) carries the effect its registry entry declares."
        },
        "phase": { "$ref": "#/$defs/phase" },
        "network": { "const": true },
        "interactive": { "const": true },
        "unmet": {
          "type": "array",
          "minItems": 1,
          "uniqueItems": true,
          "items": { "type": "string", "minLength": 1 },
          "$comment": "The capabilities this check required but the environment did not satisfy (e.g. ['playwright'] not installed, ['macos'] wrong platform, ['built-dir'] no build output). Present ONLY on a skipped check, and only when the skip was capability-driven — an artifact simply being absent skips without it. Binary capabilities are open-ended names, so this is not a closed enum."
        },
        "fix": {
          "type": "string",
          "minLength": 1,
          "$comment": "Machine-readable remediation. The verdict-side mirror of effect: effect is the risk read before acting, fix is the remediation read after a failure. Required on a failed check."
        },
        "rerun": {
          "type": "string",
          "minLength": 1,
          "$comment": "The exact, deterministic command that reproduces this one check standalone. Required on a failed check."
        },
        "detail": {
          "type": "string",
          "$comment": "The failure's specifics — which link/line/path/output — the same text the human report folds in. Emitted on a failed check so an agent acts on the --json verdict without parsing the markdown report."
        }
      },
      "if": {
        "properties": { "status": { "const": "fail" } },
        "required": ["status"]
      },
      "then": {
        "$comment": "A failed check must carry its remediation: machine-readable fix + the deterministic command that reproduces it. The property shapes are defined on the check object above; they are restated here only so the requirement is self-contained under strict validation.",
        "required": ["fix", "rerun"],
        "properties": {
          "fix": { "type": "string", "minLength": 1 },
          "rerun": { "type": "string", "minLength": 1 }
        }
      },
      "dependentSchemas": {
        "unmet": {
          "$comment": "`unmet` is the capability-skip reason, so it can appear only on a skipped check.",
          "properties": { "status": { "const": "skip" } },
          "required": ["status"]
        }
      }
    }
  }
}
